{
    "_id": "OEBA002t0000CY",
    "_schema": "https://www.elixir-europe.org/excelerate/WP2/json-schemas/1.0/TestAction",
    "action_type": "MetricsEvent",
    "challenge_id": "OEBX002t00000C",
    "dates": {
        "creation": "2018-04-05T00:00:00Z",
        "reception": "2018-04-05T00:00:00Z"
    },
    "involved_datasets": [
        {
            "dataset_id": "OEBD002t000084",
            "role": "incoming"
        },
        {
            "dataset_id": "OEBD002t00002L",
            "role": "incoming"
        },
        {
            "dataset_id": "OEBD002t0000DX",
            "role": "outgoing"
        }
    ],
    "orig_id": "TCGA:2018-04-05_KIRC_metricsEvent_ActiveDriver_precision",
    "test_contact_ids": [
        "Matthew.Bailey",
        "Eduard.Porta",
        "Collin.Tokheim"
    ],
    "tool_id": "OEBT0020000002"
}