{
    "_id": "TCGA:2018-04-05_HNSC_metricsEvent_2020plus_precision",
    "_schema": "https://www.elixir-europe.org/excelerate/WP2/json-schemas/1.0/TestAction",
    "action_type": "MetricsEvent",
    "challenge_id": "TCGA:2018-04-05_HNSC",
    "dates": {
        "creation": "2018-04-05T00:00:00Z",
        "reception": "2018-04-05T00:00:00Z"
    },
    "involved_datasets": [
        {
            "dataset_id": "TCGA:2018-04-05_HNSC_M",
            "role": "incoming"
        },
        {
            "dataset_id": "TCGA:2018-04-05_HNSC_P_2020plus",
            "role": "incoming"
        },
        {
            "dataset_id": "TCGA:2018-04-05_HNSC_A_precision_2020plus",
            "role": "outgoing"
        }
    ],
    "test_contact_ids": [
        "Matthew.Bailey",
        "Eduard.Porta",
        "Collin.Tokheim"
    ],
    "tool_id": "TCGA:2020plus"
}