{
    "_id": "QfO:2011-07-07_testEvent_STD_Eukaryota_OrthoFinder-2.0-BLAST",
    "_schema": "https://www.elixir-europe.org/excelerate/WP2/json-schemas/1.0/TestAction",
    "action_type": "TestEvent",
    "challenge_id": "QfO:2011-07-07_STD_Eukaryota",
    "dates": {
        "creation": "2011-07-07T00:00:00Z",
        "reception": "2011-07-07T00:00:00Z"
    },
    "involved_datasets": [
        {
            "dataset_id": "QfO:2011-07-07_I",
            "role": "incoming"
        },
        {
            "dataset_id": "QfO:2011-07-07_P_OrthoFinder-2.0-BLAST",
            "role": "outgoing"
        }
    ],
    "test_contact_ids": [
        "Christophe.Dessimoz",
        "Paul.Thomas",
        "Toni.Gabaldon",
        "Erik.Sonnhammer"
    ],
    "tool_id": "QfO:OrthoFinder-2.0-BLAST"
}