{
    "_id": "OEBA002t0000LN",
    "_schema": "https://www.elixir-europe.org/excelerate/WP2/json-schemas/1.0/TestAction",
    "action_type": "MetricsEvent",
    "challenge_id": "OEBX002t00000W",
    "dates": {
        "creation": "2018-04-05T00:00:00Z",
        "reception": "2018-04-05T00:00:00Z"
    },
    "involved_datasets": [
        {
            "dataset_id": "OEBD002t00008O",
            "role": "incoming"
        },
        {
            "dataset_id": "OEBD002t00006Y",
            "role": "incoming"
        },
        {
            "dataset_id": "OEBD002t0000MM",
            "role": "outgoing"
        }
    ],
    "orig_id": "TCGA:2018-04-05_UCEC_metricsEvent_compositeDriver_TPR",
    "test_contact_ids": [
        "Matthew.Bailey",
        "Eduard.Porta",
        "Collin.Tokheim"
    ],
    "tool_id": "OEBT0020000003"
}