{
    "_id": "OEBA002t0000CA",
    "_schema": "https://www.elixir-europe.org/excelerate/WP2/json-schemas/1.0/TestAction",
    "action_type": "MetricsEvent",
    "challenge_id": "OEBX002t00000B",
    "dates": {
        "creation": "2018-04-05T00:00:00Z",
        "reception": "2018-04-05T00:00:00Z"
    },
    "involved_datasets": [
        {
            "dataset_id": "OEBD002t000083",
            "role": "incoming"
        },
        {
            "dataset_id": "OEBD002t000029",
            "role": "incoming"
        },
        {
            "dataset_id": "OEBD002t0000D9",
            "role": "outgoing"
        }
    ],
    "orig_id": "TCGA:2018-04-05_KICH_metricsEvent_MutSig2CV_precision",
    "test_contact_ids": [
        "Matthew.Bailey",
        "Eduard.Porta",
        "Collin.Tokheim"
    ],
    "tool_id": "OEBT0020000006"
}