{
    "_id": "OEBA002t0000U7",
    "_schema": "https://www.elixir-europe.org/excelerate/WP2/json-schemas/1.0/TestAction",
    "action_type": "StatisticsEvent",
    "challenge_id": "OEBX002t00000V",
    "dates": {
        "creation": "2018-04-05T00:00:00Z",
        "reception": "2018-04-05T00:00:00Z"
    },
    "involved_datasets": [
        {
            "dataset_id": "OEBD002t0000MG",
            "role": "incoming"
        },
        {
            "dataset_id": "OEBD002t0000MH",
            "role": "incoming"
        },
        {
            "dataset_id": "OEBD002t0000V6",
            "role": "outgoing"
        }
    ],
    "orig_id": "TCGA:2018-04-05_THYM_OncodriveCLUST_do_summary",
    "test_contact_ids": [
        "Matthew.Bailey",
        "Eduard.Porta",
        "Collin.Tokheim"
    ],
    "tool_id": "OEBT0020000007"
}