{
    "_id": "QfO:2011-07-07_STD_Eukaryota_metricsEvent_GETHOGs-2.0_STD_num_orthologs",
    "_schema": "https://www.elixir-europe.org/excelerate/WP2/json-schemas/1.0/TestAction",
    "action_type": "MetricsEvent",
    "challenge_id": "QfO:2011-07-07_STD_Eukaryota",
    "dates": {
        "creation": "2011-07-07T00:00:00Z",
        "reception": "2011-07-07T00:00:00Z"
    },
    "involved_datasets": [
        {
            "dataset_id": "QfO:2011-07-07_STD_Eukaryota_M",
            "role": "incoming"
        },
        {
            "dataset_id": "QfO:2011-07-07_P_GETHOGs-2.0",
            "role": "incoming"
        },
        {
            "dataset_id": "QfO:2011-07-07_STD_Eukaryota_A_STD_num_orthologs_GETHOGs-2.0",
            "role": "outgoing"
        }
    ],
    "test_contact_ids": [
        "Christophe.Dessimoz",
        "Paul.Thomas",
        "Toni.Gabaldon",
        "Erik.Sonnhammer"
    ],
    "tool_id": "QfO:GETHOGs-2.0"
}