{
    "_id": "TCGA:2018-04-05_BLCA_metricsEvent_e-Driver_TPR",
    "_schema": "https://www.elixir-europe.org/excelerate/WP2/json-schemas/1.0/TestAction",
    "action_type": "MetricsEvent",
    "challenge_id": "TCGA:2018-04-05_BLCA",
    "dates": {
        "creation": "2018-04-05T00:00:00Z",
        "reception": "2018-04-05T00:00:00Z"
    },
    "involved_datasets": [
        {
            "dataset_id": "TCGA:2018-04-05_BLCA_M",
            "role": "incoming"
        },
        {
            "dataset_id": "TCGA:2018-04-05_BLCA_P_e-Driver",
            "role": "incoming"
        },
        {
            "dataset_id": "TCGA:2018-04-05_BLCA_A_TPR_e-Driver",
            "role": "outgoing"
        }
    ],
    "test_contact_ids": [
        "Matthew.Bailey",
        "Eduard.Porta",
        "Collin.Tokheim"
    ],
    "tool_id": "TCGA:e-Driver"
}