{
    "_id": "OEBA002t00008D",
    "_schema": "https://www.elixir-europe.org/excelerate/WP2/json-schemas/1.0/TestAction",
    "action_type": "MetricsEvent",
    "challenge_id": "OEBX002t000002",
    "dates": {
        "creation": "2018-04-05T00:00:00Z",
        "reception": "2018-04-05T00:00:00Z"
    },
    "involved_datasets": [
        {
            "dataset_id": "OEBD002t00007U",
            "role": "incoming"
        },
        {
            "dataset_id": "OEBD002t00000B",
            "role": "incoming"
        },
        {
            "dataset_id": "OEBD002t00009C",
            "role": "outgoing"
        }
    ],
    "orig_id": "TCGA:2018-04-05_BLCA_metricsEvent_2020plus_TPR",
    "test_contact_ids": [
        "Matthew.Bailey",
        "Eduard.Porta",
        "Collin.Tokheim"
    ],
    "tool_id": "OEBT0020000001"
}