{
    "_id": "QfO:2011-07-07_ECtest_metricsEvent_InParanoidCore_ECTest_schlicker",
    "_schema": "https://www.elixir-europe.org/excelerate/WP2/json-schemas/1.0/TestAction",
    "action_type": "MetricsEvent",
    "challenge_id": "QfO:2011-07-07_ECtest",
    "dates": {
        "creation": "2011-07-07T00:00:00Z",
        "reception": "2011-07-07T00:00:00Z"
    },
    "involved_datasets": [
        {
            "dataset_id": "QfO:2011-07-07_ECtest_M",
            "role": "incoming"
        },
        {
            "dataset_id": "QfO:2011-07-07_P_InParanoidCore",
            "role": "incoming"
        },
        {
            "dataset_id": "QfO:2011-07-07_ECtest_A_ECTest_schlicker_InParanoidCore",
            "role": "outgoing"
        }
    ],
    "test_contact_ids": [
        "Christophe.Dessimoz",
        "Paul.Thomas",
        "Toni.Gabaldon",
        "Erik.Sonnhammer"
    ],
    "tool_id": "QfO:InParanoidCore"
}